{
  "$schema": "vault",
  "comment": "Curve ibGBP",
  "hideAlways": false,
  "depositsDisabled": true,
  "withdrawalsDisabled": false,
  "order": 21.61,
  "migrationAvailable": true,
  "migrationContract": "0x9327e2FDc57c7d70782F29AB46F6385afaf4503C",
  "migrationTargetVault": "0xbE4afE6737CCf34cA21cdeF461E5C7547Adc8C77",
  "allowZapIn": false,
  "allowZapOut": true,
  "retired": true,
  "displayName": "Curve ibGBP",
  "classification": {
    "isAutomated": false,
    "isPool": true,
    "poolProvider": "Curve",
    "stability": "Correlated",
    "stableBaseAsset": "GBP"
  }
}
