{
  "$schema": "vault",
  "comment": "Ape 3.5 Rai Vault",
  "hideAlways": true,
  "depositsDisabled": true,
  "withdrawalsDisabled": false,
  "order": 215,
  "migrationAvailable": true,
  "migrationContract": "0x1824df8D751704FA10FA371d62A37f9B8772ab90",
  "migrationTargetVault": "0x873fB544277FD7b977B196a826459a69E27eA4ea",
  "allowZapIn": false,
  "allowZapOut": true,
  "retired": true,
  "displayName": "Rai",
  "classification": {
    "isAutomated": false,
    "isPool": false,
    "stability": "Unstable"
  }
}
