{
  "$schema": "vault",
  "comment": "Curve ibGBP-USDC Pool yVault",
  "hideAlways": false,
  "depositsDisabled": false,
  "withdrawalsDisabled": false,
  "order": 91,
  "migrationAvailable": false,
  "allowZapIn": true,
  "allowZapOut": true,
  "retired": true,
  "displayName": "Curve ibGBP-USDC",
  "classification": {
    "isAutomated": false,
    "isPool": true,
    "poolProvider": "Curve",
    "stability": "Volatile"
  }
}
