{
  "$schema": "vault",
  "comment": "Curve MIM 3Pool",
  "hideAlways": false,
  "depositsDisabled": false,
  "withdrawalsDisabled": false,
  "order": 8,
  "migrationAvailable": false,
  "allowZapIn": true,
  "allowZapOut": true,
  "retired": false,
  "displayName": "Curve MIM 3Pool",
  "classification": {
    "isAutomated": false,
    "isPool": true,
    "poolProvider": "Curve",
    "stability": "Stable",
    "stableBaseAsset": "USD"
  }
}
