{
  "$schema": "vault",
  "comment": "Curve alUSD",
  "hideAlways": false,
  "depositsDisabled": false,
  "withdrawalsDisabled": false,
  "order": 25,
  "allowZapIn": true,
  "allowZapOut": true,
  "retired": false,
  "displayName": "Curve alUSD",
  "migrationAvailable": true,
  "migrationContract": "0x9327e2fdc57c7d70782f29ab46f6385afaf4503c",
  "migrationTargetVault": "0x4CbB6A5EC00cEEC252a7091559484F7adb83165f",
  "classification": {
    "isAutomated": false,
    "isPool": true,
    "poolProvider": "Curve",
    "stability": "Stable",
    "stableBaseAsset": "USD"
  }
}
