{
  "$schema": "vault",
  "comment": "Curve cvxCRV-CRV-f",
  "hideAlways": false,
  "depositsDisabled": false,
  "withdrawalsDisabled": false,
  "order": 316,
  "migrationAvailable": false,
  "allowZapIn": true,
  "allowZapOut": true,
  "retired": false,
  "displayName": "Curve cvxCRV-CRV",
  "classification": {
    "isAutomated": true,
    "isPool": true,
    "poolProvider": "Curve",
    "stability": "Correlated",
    "stableBaseAsset": "CRV"
  }
}