{
  "$schema": "vault",
  "comment": "Curve ibEUR-f",
  "hideAlways": false,
  "depositsDisabled": false,
  "withdrawalsDisabled": false,
  "order": 268,
  "allowZapIn": true,
  "allowZapOut": true,
  "retired": false,
  "displayName": "Curve ibEUR",
  "migrationAvailable": false,
  "classification": {
    "isAutomated": true,
    "isPool": true,
    "poolProvider": "Curve",
    "stability": "Correlated",
    "stableBaseAsset": "EUR"
  }
}
