{
  "$schema": "vault",
  "comment": "4.2 Comp Vault",
  "hideAlways": true,
  "depositsDisabled": true,
  "withdrawalsDisabled": false,
  "order": 245,
  "migrationAvailable": true,
  "migrationContract": "0x1824df8D751704FA10FA371d62A37f9B8772ab90",
  "migrationTargetVault": "0x4A3FE75762017DB0eD73a71C9A06db7768DB5e66",
  "allowZapIn": false,
  "allowZapOut": true,
  "retired": true,
  "displayName": "Comp",
  "classification": {
    "isAutomated": false,
    "isPool": false,
    "stability": "Volatile"
  }
}
