{
  "$schema": "vault",
  "comment": "Curve frxETH-stETH-f",
  "hideAlways": false,
  "depositsDisabled": false,
  "withdrawalsDisabled": false,
  "order": 343,
  "allowZapIn": true,
  "allowZapOut": true,
  "retired": false,
  "displayName": "Curve frxETH-stETH",
  "migrationAvailable": false,
  "classification": {
    "isAutomated": true,
    "isPool": true,
    "poolProvider": "Curve",
    "stability": "Stable",
    "stableBaseAsset": "Ether"
  }
}
