{
  "$schema": "vault",
  "comment": "Curve Stax Frax Temple lp Vault",
  "hideAlways": true,
  "depositsDisabled": true,
  "withdrawalsDisabled": false,
  "order": 249,
  "migrationAvailable": false,
  "allowZapIn": false,
  "allowZapOut": true,
  "retired": true,
  "displayName": "Curve FraxTplLP",
  "classification": {
    "isAutomated": false,
    "isPool": true,
    "poolProvider": "Curve",
    "stability": "Volatile"
  }
}
