{
  "$schema": "vault",
  "comment": "UNI",
  "hideAlways": false,
  "depositsDisabled": false,
  "withdrawalsDisabled": false,
  "order": 15,
  "migrationAvailable": false,
  "allowZapIn": true,
  "allowZapOut": true,
  "retired": false,
  "displayName": "UNI",
  "classification": {
    "isAutomated": false,
    "isPool": false,
    "stability": "Volatile"
  }
}
