{
  "$schema": "vault",
  "comment": "Curve stETH-f",
  "hideAlways": false,
  "depositsDisabled": false,
  "withdrawalsDisabled": false,
  "order": 266,
  "allowZapIn": true,
  "allowZapOut": true,
  "retired": false,
  "displayName": "Curve stETH",
  "migrationAvailable": false,
  "classification": {
    "isAutomated": true,
    "isPool": true,
    "poolProvider": "Curve",
    "stability": "Correlated",
    "stableBaseAsset": "Ether"
  }
}
