{
  "$schema": "vault",
  "comment": "yvBoost-yswap",
  "hideAlways": true,
  "depositsDisabled": true,
  "withdrawalsDisabled": false,
  "order": 212,
  "migrationAvailable": false,
  "allowZapIn": false,
  "allowZapOut": true,
  "retired": true,
  "displayName": "yvBoost-yswap",
  "classification": {
    "isAutomated": false,
    "isPool": false,
    "stability": "Correlated",
    "stableBaseAsset": "CRV"
  }
}
