{
  "$schema": "vault",
  "comment": "4.3 yveCRV vault",
  "hideAlways": true,
  "depositsDisabled": true,
  "withdrawalsDisabled": false,
  "order": 220,
  "migrationAvailable": false,
  "allowZapIn": false,
  "allowZapOut": true,
  "retired": true,
  "displayName": "Curve yveCRV Pool",
  "classification": {
    "isAutomated": false,
    "isPool": true,
    "poolProvider": "Curve",
    "stability": "Correlated",
    "stableBaseAsset": "CRV"
  }
}
